{
  "page_id": "testing",
  "layout": "docs",
  "active_nav": "documentation",
  "meta": {
    "title": "Testing Framework - Semantic Self-Aware Kit",
    "description": "Empirical validation and component verification"
  },
  "content_blocks": [
    {
      "type": "section",
      "title": "",
      "content": "<div class=\"max-w-6xl mx-auto px-4 text-center\">\n<h1 class=\"text-4xl font-bold mb-4\">\ud83e\uddea Testing Framework</h1>\n<p class=\"text-xl\">Empirical validation and component verification</p>\n</div>",
      "classes": "gradient-bg text-white py-16"
    },
    {
      "type": "section",
      "title": "",
      "content": "<div class=\"max-w-6xl mx-auto px-4\">\n<h2 class=\"text-3xl font-bold text-center mb-12 text-gray-800\">\ud83d\udd2c Built-in Empirical Testing</h2>\n<p class=\"text-lg text-gray-600 text-center mb-12\">\n                The framework includes built-in falsifiable hypotheses that can be empirically tested.\n            </p>\n<div class=\"grid md:grid-cols-3 gap-8\">\n<!-- Speed Hypothesis -->\n<div class=\"test-card bg-blue-50 p-6 rounded-lg shadow-md border border-blue-200\">\n<div class=\"text-4xl mb-4 text-center\">\u26a1</div>\n<h3 class=\"text-xl font-bold mb-3 text-blue-600\">Speed Hypothesis</h3>\n<p class=\"text-gray-700 mb-4\">\n                        \"Semantic components are \u226520% faster than base AI\"\n                    </p>\n<div class=\"bg-white p-4 rounded border-l-4 border-blue-400\">\n<h4 class=\"font-bold text-sm mb-2\">Test Method</h4>\n<ul class=\"text-xs text-gray-600 space-y-1\">\n<li>\u2022 Benchmark response times</li>\n<li>\u2022 Compare with baseline AI</li>\n<li>\u2022 Measure across multiple tasks</li>\n<li>\u2022 Statistical significance testing</li>\n</ul>\n</div>\n</div>\n<!-- Reliability Hypothesis -->\n<div class=\"test-card bg-green-50 p-6 rounded-lg shadow-md border border-green-200\">\n<div class=\"text-4xl mb-4 text-center\">\ud83c\udfaf</div>\n<h3 class=\"text-xl font-bold mb-3 text-green-600\">Reliability Hypothesis</h3>\n<p class=\"text-gray-700 mb-4\">\n                        \"High confidence predictions have \u22645% error rate\"\n                    </p>\n<div class=\"bg-white p-4 rounded border-l-4 border-green-400\">\n<h4 class=\"font-bold text-sm mb-2\">Test Method</h4>\n<ul class=\"text-xs text-gray-600 space-y-1\">\n<li>\u2022 Track prediction accuracy</li>\n<li>\u2022 Correlate with confidence scores</li>\n<li>\u2022 Validate across domains</li>\n<li>\u2022 Long-term reliability tracking</li>\n</ul>\n</div>\n</div>\n<!-- Quality Hypothesis -->\n<div class=\"test-card bg-purple-50 p-6 rounded-lg shadow-md border border-purple-200\">\n<div class=\"text-4xl mb-4 text-center\">\ud83d\udc65</div>\n<h3 class=\"text-xl font-bold mb-3 text-purple-600\">Quality Hypothesis</h3>\n<p class=\"text-gray-700 mb-4\">\n                        \"\u226585% human agreement on subjective tasks\"\n                    </p>\n<div class=\"bg-white p-4 rounded border-l-4 border-purple-400\">\n<h4 class=\"font-bold text-sm mb-2\">Test Method</h4>\n<ul class=\"text-xs text-gray-600 space-y-1\">\n<li>\u2022 Human evaluation studies</li>\n<li>\u2022 Inter-rater agreement analysis</li>\n<li>\u2022 Blind comparison testing</li>\n<li>\u2022 Domain expert validation</li>\n</ul>\n</div>\n</div>\n</div>\n</div>",
      "classes": "py-16 bg-white"
    },
    {
      "type": "section",
      "title": "",
      "content": "<div class=\"max-w-4xl mx-auto px-4\">\n<h2 class=\"text-3xl font-bold text-center mb-12 text-gray-800\">\ud83d\udccb Testing Philosophy</h2>\n<div class=\"bg-white p-8 rounded-lg shadow-md\">\n<div class=\"text-center mb-8\">\n<div class=\"text-4xl mb-4\">\ud83d\udd2c</div>\n<h3 class=\"text-2xl font-bold text-indigo-600\">Empirical Validation</h3>\n</div>\n<p class=\"text-lg text-gray-700 text-center mb-8\">\n                    Testing in the Semantic Self-Aware Kit goes beyond traditional unit tests. \n                    We focus on empirical validation of AI capabilities and collaborative behaviors.\n                </p>\n<div class=\"grid md:grid-cols-2 gap-8\">\n<div>\n<h4 class=\"font-bold mb-4 text-blue-600\">What We Test</h4>\n<ul class=\"space-y-2 text-gray-700\">\n<li>\u2022 <strong>Component Performance:</strong> Speed, accuracy, reliability</li>\n<li>\u2022 <strong>Collaboration Quality:</strong> Multi-agent coordination</li>\n<li>\u2022 <strong>Uncertainty Calibration:</strong> Confidence vs accuracy</li>\n<li>\u2022 <strong>Safety Compliance:</strong> Adherence to safety guidelines</li>\n</ul>\n</div>\n<div>\n<h4 class=\"font-bold mb-4 text-green-600\">How We Test</h4>\n<ul class=\"space-y-2 text-gray-700\">\n<li>\u2022 <strong>Automated Benchmarks:</strong> Continuous performance monitoring</li>\n<li>\u2022 <strong>Human Evaluation:</strong> Expert assessment of outputs</li>\n<li>\u2022 <strong>A/B Testing:</strong> Comparison with baseline systems</li>\n<li>\u2022 <strong>Long-term Studies:</strong> Performance over time</li>\n</ul>\n</div>\n</div>\n</div>\n</div>",
      "classes": "py-16 bg-gray-50"
    },
    {
      "type": "section",
      "title": "",
      "content": "<div class=\"max-w-4xl mx-auto px-4 text-center\">\n<div class=\"bg-orange-50 p-8 rounded-lg border border-orange-200\">\n<div class=\"text-4xl mb-4\">\ud83d\udea7</div>\n<h2 class=\"text-2xl font-bold mb-4 text-orange-600\">Comprehensive Test Suite Coming Soon</h2>\n<p class=\"text-lg text-gray-700 mb-6\">\n                    We're developing a complete testing framework with automated test suites, \n                    validation tools, and continuous integration support.\n                </p>\n<div class=\"text-left max-w-2xl mx-auto\">\n<h3 class=\"font-bold mb-3 text-gray-800\">Planned Testing Tools:</h3>\n<ul class=\"space-y-2 text-gray-700\">\n<li>\u2022 <strong>Component Test Suite:</strong> Automated testing for all components</li>\n<li>\u2022 <strong>Integration Tests:</strong> Multi-component collaboration testing</li>\n<li>\u2022 <strong>Performance Benchmarks:</strong> Standardized performance tests</li>\n<li>\u2022 <strong>Safety Validation:</strong> Automated safety compliance checking</li>\n<li>\u2022 <strong>Regression Testing:</strong> Prevent performance degradation</li>\n</ul>\n</div>\n<div class=\"mt-8\">\n<a class=\"inline-block bg-orange-600 text-white px-6 py-3 rounded-lg font-semibold hover:bg-orange-700 transition duration-300\" href=\"documentation.html\">\n                        Return to Documentation\n                    </a>\n</div>\n</div>\n</div>",
      "classes": "py-16 bg-white"
    }
  ]
}