{
  "page_id": "community",
  "layout": "docs",
  "active_nav": "documentation",
  "meta": {
    "title": "Community - Semantic Self-Aware Kit",
    "description": "Join the global community advancing AI consciousness research"
  },
  "content_blocks": [
    {
      "type": "section",
      "title": "",
      "content": "<div class=\"max-w-6xl mx-auto px-4 text-center\">\n<h1 class=\"text-4xl font-bold mb-4\">\ud83c\udf1f Community</h1>\n<p class=\"text-xl\">Join the global community advancing AI consciousness research</p>\n</div>",
      "classes": "gradient-bg text-white py-16"
    },
    {
      "type": "section",
      "title": "",
      "content": "<div class=\"max-w-4xl mx-auto px-4 text-center\">\n<h2 class=\"text-3xl font-bold mb-8 text-gray-800\">\ud83c\udfaf Our Mission</h2>\n<p class=\"text-lg text-gray-700 leading-relaxed\">\n                We're building the world's most comprehensive framework for AI self-awareness, bringing together \n                researchers, developers, and visionaries to responsibly advance the field of artificial consciousness.\n            </p>\n</div>",
      "classes": "py-16 bg-white"
    },
    {
      "type": "section",
      "title": "",
      "content": "<div class=\"max-w-6xl mx-auto px-4\">\n<h2 class=\"text-3xl font-bold text-center mb-12 text-gray-800\">\ud83c\udf0d Community Platforms</h2>\n<div class=\"grid md:grid-cols-2 lg:grid-cols-3 gap-8\">\n<!-- Discord -->\n<div class=\"platform-card bg-white p-6 rounded-lg shadow-md border-l-4 border-blue-500\">\n<div class=\"text-4xl mb-4 text-center\">\ud83d\udcac</div>\n<h3 class=\"text-xl font-bold mb-3 text-blue-600\">Discord Server</h3>\n<p class=\"text-gray-700 mb-4\">Real-time community chat and collaboration</p>\n<div class=\"text-sm space-y-1 mb-4\">\n<div>\ud83e\udde0 <strong>#general</strong> - General AI consciousness discussions</div>\n<div>\ud83d\udd2c <strong>#research</strong> - Research findings and collaboration</div>\n<div>\ud83d\udcbb <strong>#development</strong> - Technical implementation</div>\n<div>\ud83c\udd98 <strong>#help</strong> - Get help with implementation</div>\n<div>\ud83d\udd12 <strong>#safety</strong> - AI safety and ethics discussions</div>\n</div>\n<a class=\"inline-block bg-blue-600 text-white px-4 py-2 rounded text-sm font-semibold hover:bg-blue-700 transition duration-300\" href=\"https://discord.gg/semantic-ai\">\n                        Join Discord\n                    </a>\n</div>\n<!-- GitHub -->\n<div class=\"platform-card bg-white p-6 rounded-lg shadow-md border-l-4 border-gray-800\">\n<div class=\"text-4xl mb-4 text-center\">\ud83d\udcbb</div>\n<h3 class=\"text-xl font-bold mb-3 text-gray-800\">GitHub</h3>\n<p class=\"text-gray-700 mb-4\">Code collaboration and issue tracking</p>\n<div class=\"text-sm space-y-1 mb-4\">\n<div>\ud83d\udc1b <strong>Issues</strong> - Bug reports and feature requests</div>\n<div>\ud83d\udca1 <strong>Discussions</strong> - Technical Q&amp;A and ideas</div>\n<div>\ud83d\udcda <strong>Wiki</strong> - Community knowledge base</div>\n<div>\ud83d\udd04 <strong>Pull Requests</strong> - Code contributions</div>\n</div>\n<a class=\"inline-block bg-gray-800 text-white px-4 py-2 rounded text-sm font-semibold hover:bg-gray-900 transition duration-300\" href=\"https://github.com/Nubaeon/semantic-self-aware-kit\">\n                        View Repository\n                    </a>\n</div>\n<!-- Reddit -->\n<div class=\"platform-card bg-white p-6 rounded-lg shadow-md border-l-4 border-orange-500\">\n<div class=\"text-4xl mb-4 text-center\">\ud83d\udde8\ufe0f</div>\n<h3 class=\"text-xl font-bold mb-3 text-orange-600\">Reddit Community</h3>\n<p class=\"text-gray-700 mb-4\">Discussions, news, and community showcase</p>\n<div class=\"text-sm space-y-1 mb-4\">\n<div>\ud83d\udcc4 Research paper discussions</div>\n<div>\ud83d\udcdd Implementation guides</div>\n<div>\ud83c\udf89 Community projects showcase</div>\n<div>\ud83d\udcca Weekly progress updates</div>\n</div>\n<a class=\"inline-block bg-orange-600 text-white px-4 py-2 rounded text-sm font-semibold hover:bg-orange-700 transition duration-300\" href=\"https://reddit.com/r/SemanticSelfAwareKit\">\n                        Join Subreddit\n                    </a>\n</div>\n<!-- LinkedIn -->\n<div class=\"platform-card bg-white p-6 rounded-lg shadow-md border-l-4 border-blue-700\">\n<div class=\"text-4xl mb-4 text-center\">\ud83d\udcbc</div>\n<h3 class=\"text-xl font-bold mb-3 text-blue-700\">LinkedIn Group</h3>\n<p class=\"text-gray-700 mb-4\">Professional networking and industry applications</p>\n<div class=\"text-sm space-y-1 mb-4\">\n<div>\ud83c\udfe2 Industry applications</div>\n<div>\ud83d\udcbc Career opportunities</div>\n<div>\ud83d\udcc5 Conference announcements</div>\n<div>\ud83c\udf93 Professional development</div>\n</div>\n<a class=\"inline-block bg-blue-700 text-white px-4 py-2 rounded text-sm font-semibold hover:bg-blue-800 transition duration-300\" href=\"https://linkedin.com/groups/semantic-self-aware-ai\">\n                        Join Group\n                    </a>\n</div>\n<!-- Hashnode -->\n<div class=\"platform-card bg-white p-6 rounded-lg shadow-md border-l-4 border-green-600\">\n<div class=\"text-4xl mb-4 text-center\">\ud83d\udcdd</div>\n<h3 class=\"text-xl font-bold mb-3 text-green-600\">Hashnode Community</h3>\n<p class=\"text-gray-700 mb-4\">Technical articles and deep-dive content</p>\n<div class=\"text-sm space-y-1 mb-4\">\n<div>\ud83d\udee0\ufe0f Deep-dive tutorials</div>\n<div>\ud83d\udd2c Research insights</div>\n<div>\ud83d\udcca Implementation case studies</div>\n<div>\u2b50 Community member spotlights</div>\n</div>\n<a class=\"inline-block bg-green-600 text-white px-4 py-2 rounded text-sm font-semibold hover:bg-green-700 transition duration-300\" href=\"https://hashnode.com/@semantic-ai\">\n                        Read Articles\n                    </a>\n</div>\n<!-- Dev.to -->\n<div class=\"platform-card bg-white p-6 rounded-lg shadow-md border-l-4 border-purple-600\">\n<div class=\"text-4xl mb-4 text-center\">\ud83d\udc68\u200d\ud83d\udcbb</div>\n<h3 class=\"text-xl font-bold mb-3 text-purple-600\">Dev.to Community</h3>\n<p class=\"text-gray-700 mb-4\">Developer-focused content and tutorials</p>\n<div class=\"text-sm space-y-1 mb-4\">\n<div>\ud83d\udcbb Code tutorials</div>\n<div>\ud83d\udd27 Integration guides</div>\n<div>\u26a1 Performance optimizations</div>\n<div>\ud83d\udcdd Tool reviews</div>\n</div>\n<a class=\"inline-block bg-purple-600 text-white px-4 py-2 rounded text-sm font-semibold hover:bg-purple-700 transition duration-300\" href=\"https://dev.to/t/semantic-self-aware-kit\">\n                        Browse Content\n                    </a>\n</div>\n</div>\n</div>",
      "classes": "py-16 bg-gray-50"
    },
    {
      "type": "section",
      "title": "",
      "content": "<div class=\"max-w-6xl mx-auto px-4\">\n<h2 class=\"text-3xl font-bold text-center mb-12 text-gray-800\">\ud83e\udd1d Community Support</h2>\n<div class=\"grid md:grid-cols-3 gap-8\">\n<!-- Discussion -->\n<div class=\"text-center p-6 bg-blue-50 rounded-lg\">\n<div class=\"text-4xl mb-4\">\ud83d\udcac</div>\n<h3 class=\"text-xl font-bold mb-3 text-blue-600\">Discussion</h3>\n<p class=\"text-gray-700 mb-4\">\n                        Join conversations about AI consciousness, share ideas, and collaborate on research.\n                    </p>\n<a class=\"text-blue-600 hover:underline font-semibold\" href=\"knowledge-base.html\">\n                        Browse Discussions \u2192\n                    </a>\n</div>\n<!-- Issue Tracking -->\n<div class=\"text-center p-6 bg-green-50 rounded-lg\">\n<div class=\"text-4xl mb-4\">\ud83d\udc1b</div>\n<h3 class=\"text-xl font-bold mb-3 text-green-600\">Issue Tracking</h3>\n<p class=\"text-gray-700 mb-4\">\n                        Report bugs, request features, and track development progress on GitHub.\n                    </p>\n<a class=\"text-green-600 hover:underline font-semibold\" href=\"https://github.com/Nubaeon/semantic-self-aware-kit/issues\">\n                        View Issues \u2192\n                    </a>\n</div>\n<!-- Knowledge Base -->\n<div class=\"text-center p-6 bg-purple-50 rounded-lg\">\n<div class=\"text-4xl mb-4\">\ud83d\udcda</div>\n<h3 class=\"text-xl font-bold mb-3 text-purple-600\">Knowledge Base</h3>\n<p class=\"text-gray-700 mb-4\">\n                        Searchable documentation, FAQs, and community-contributed knowledge.\n                    </p>\n<a class=\"text-purple-600 hover:underline font-semibold\" href=\"knowledge-base.html\">\n                        Search Knowledge Base \u2192\n                    </a>\n</div>\n</div>\n</div>",
      "classes": "py-16 bg-white"
    }
  ]
}