{
  "page_id": "development-tools",
  "layout": "docs",
  "active_nav": "documentation",
  "meta": {
    "title": "Development Tools - Semantic Self-Aware Kit",
    "description": "CLI tools and utilities for framework integration"
  },
  "content_blocks": [
    {
      "type": "section",
      "title": "",
      "content": "<div class=\"max-w-6xl mx-auto px-4 text-center\">\n<h1 class=\"text-4xl font-bold mb-4\">\ud83d\udee0\ufe0f Development Tools</h1>\n<p class=\"text-xl\">CLI tools and utilities for framework integration</p>\n</div>",
      "classes": "gradient-bg text-white py-16"
    },
    {
      "type": "section",
      "title": "",
      "content": "<div class=\"max-w-4xl mx-auto px-4 text-center\">\n<div class=\"bg-blue-50 p-8 rounded-lg border border-blue-200\">\n<div class=\"text-6xl mb-4\">\ud83d\ude80</div>\n<h2 class=\"text-2xl font-bold mb-4 text-green-600\">Full CLI Suite - 16 Commands Available!</h2>\n<p class=\"text-lg text-gray-700 mb-6\">\n                    Complete command-line interface with 100% component coverage - perfect for collaborative AI discovery and testing.\n                </p>\n<div class=\"bg-green-100 p-4 rounded mb-6\">\n<h3 class=\"font-bold mb-2 text-green-800\">\ud83d\ude80 Quick Start:</h3>\n<div class=\"bg-green-900 text-green-100 p-3 rounded font-mono text-sm\">\n                        cd semantic-self-aware-kit<br/>\n                        PYTHONPATH=. python3 semantic_self_aware_kit/cli.py --help<br/>\n                        PYTHONPATH=. python3 semantic_self_aware_kit/cli.py demo\n                    </div>\n</div>\n<div class=\"bg-blue-100 p-4 rounded mb-6\">\n<h3 class=\"font-bold mb-2 text-blue-800\">\u2705 Verified Working:</h3>\n<p class=\"text-blue-700 text-sm\">All 16 commands tested \u2705 | 21/21 components operational \u2705 | 100% self-contained SDK \u2705</p>\n</div>\n<div class=\"text-left max-w-3xl mx-auto\">\n<h3 class=\"font-bold mb-3 text-gray-800\">\ud83d\udccb All 16 Commands (Original + AI Discovery):</h3>\n<div class=\"grid md:grid-cols-4 gap-2 text-xs\">\n<div class=\"bg-purple-50 p-2 rounded\">\n<strong>\ud83e\udd14 uncertainty</strong><br/>Decision analysis\n                        </div>\n<div class=\"bg-green-50 p-2 rounded\">\n<strong>\ud83d\udd0d analyze</strong><br/>Code analysis\n                        </div>\n<div class=\"bg-blue-50 p-2 rounded\">\n<strong>\u2705 validate</strong><br/>Context validation\n                        </div>\n<div class=\"bg-red-50 p-2 rounded\">\n<strong>\ud83d\udee1\ufe0f monitor</strong><br/>Security monitoring\n                        </div>\n<div class=\"bg-indigo-50 p-2 rounded\">\n<strong>\ud83e\udded navigate</strong><br/>Workspace navigation\n                        </div>\n<div class=\"bg-yellow-50 p-2 rounded\">\n<strong>\ud83d\uddfa\ufe0f awareness</strong><br/>Workspace awareness\n                        </div>\n<div class=\"bg-teal-50 p-2 rounded\">\n<strong>\ud83e\udde0 procedural</strong><br/>Task analysis\n                        </div>\n<div class=\"bg-orange-50 p-2 rounded\">\n<strong>\ud83d\udcdd rename</strong><br/>Intelligent renaming\n                        </div>\n<div class=\"bg-pink-50 p-2 rounded border-2 border-pink-300\">\n<strong>\ud83e\udde0 self-test</strong><br/>Meta-cognitive test \u2705\n                        </div>\n<div class=\"bg-cyan-50 p-2 rounded border-2 border-cyan-300\">\n<strong>\ud83d\udcca benchmark</strong><br/>Performance analysis \u2705\n                        </div>\n<div class=\"bg-lime-50 p-2 rounded border-2 border-lime-300\">\n<strong>\ud83e\udd1d collaborate</strong><br/>AI collaboration \u2705\n                        </div>\n<div class=\"bg-violet-50 p-2 rounded border-2 border-violet-300\">\n<strong>\ud83c\udfaf cascade</strong><br/>Metacognitive reasoning \u2705\n                        </div>\n<div class=\"bg-rose-50 p-2 rounded border-2 border-rose-300\">\n<strong>\ud83d\udd2c investigate</strong><br/>Deep code analysis \u2705\n                        </div>\n<div class=\"bg-emerald-50 p-2 rounded border-2 border-emerald-300\">\n<strong>\ud83d\udccb list-components</strong><br/>Component discovery \u2705\n                        </div>\n<div class=\"bg-amber-50 p-2 rounded border-2 border-amber-300\">\n<strong>\ud83c\udfaa demo</strong><br/>Framework showcase \u2705\n                        </div>\n<div class=\"bg-slate-50 p-2 rounded border-2 border-slate-300\">\n<strong>\ud83e\uddea test-all</strong><br/>Full component test \u2705\n                        </div>\n</div>\n<p class=\"text-xs text-gray-600 mt-3\">\n                        \ud83c\udd95 <strong>Bordered commands</strong> are new AI discovery features | \u2705 All commands verified working\n                    </p>\n</div>\n<div class=\"mt-8\">\n<a class=\"inline-block bg-blue-600 text-white px-6 py-3 rounded-lg font-semibold hover:bg-blue-700 transition duration-300\" href=\"documentation.html\">\n                        Return to Documentation\n                    </a>\n</div>\n</div>\n</div>",
      "classes": "py-16 bg-white"
    }
  ]
}