{
  "page_id": "getting-started",
  "layout": "docs",
  "active_nav": "documentation",
  "meta": {
    "title": "Getting Started - Semantic Self-Aware Kit",
    "description": "Installation, setup, and first steps with the Semantic Self-Aware Kit"
  },
  "content_blocks": [
    {
      "type": "section",
      "title": "",
      "content": "<div class=\"max-w-6xl mx-auto px-4 text-center\">\n<h1 class=\"text-4xl font-bold mb-4\">\ud83d\ude80 Getting Started</h1>\n<p class=\"text-xl\">Installation, setup, and first steps with the Semantic Self-Aware Kit</p>\n</div>",
      "classes": "gradient-bg text-white py-16"
    },
    {
      "type": "section",
      "title": "",
      "content": "<div class=\"max-w-4xl mx-auto px-4\">\n<h2 class=\"text-3xl font-bold mb-8 text-gray-800\">Quick Start Overview</h2>\n<p class=\"text-lg text-gray-700 leading-relaxed mb-8\">\n                The Semantic Self-Aware Kit is a Python framework for building AI systems with semantic reasoning, \n                uncertainty quantification, and collaborative capabilities. This guide will get you up and running \n                in just a few steps.\n            </p>\n<div class=\"bg-blue-50 p-6 rounded-lg border-l-4 border-blue-500\">\n<h3 class=\"text-lg font-bold mb-3 text-blue-800\">Prerequisites</h3>\n<ul class=\"text-gray-700 space-y-1\">\n<li>\u2022 Python 3.8 or higher</li>\n<li>\u2022 pip package manager</li>\n<li>\u2022 Basic understanding of Python</li>\n<li>\u2022 Optional: Docker for containerized components</li>\n</ul>\n</div>\n</div>",
      "classes": "py-16 bg-white"
    },
    {
      "type": "section",
      "title": "",
      "content": "<div class=\"max-w-6xl mx-auto px-4\">\n<h2 class=\"text-3xl font-bold mb-8 text-gray-800\">\ud83d\udce6 Installation Guide</h2>\n<div class=\"grid lg:grid-cols-2 gap-8\">\n<!-- Method 1: From Source -->\n<div class=\"step-card bg-white p-8 rounded-lg shadow-md\">\n<div class=\"flex items-center mb-4\">\n<div class=\"bg-blue-100 rounded-full p-3 mr-4\">\n<i class=\"fab fa-github text-blue-600 text-xl\"></i>\n</div>\n<h3 class=\"text-xl font-bold text-gray-800\">Installation from Source</h3>\n</div>\n<p class=\"text-gray-600 mb-4\">For development or to get the latest features, install from source:</p>\n<div class=\"bg-gray-900 text-green-400 p-4 rounded-lg mb-4 font-mono text-sm\">\n<div># 1. Clone the repository</div>\n<div>git clone https://github.com/Nubaeon/semantic-self-aware-kit.git</div>\n<div>cd semantic-self-aware-kit</div>\n<div class=\"mt-2\"># 2. Create and activate a virtual environment</div>\n<div>python3 -m venv .venv</div>\n<div>source .venv/bin/activate</div>\n<div class=\"mt-2\"># 3. Install in development mode</div>\n<div>pip install -e .</div>\n</div>\n</div>\n<!-- Method 2: pip install -->\n<div class=\"step-card bg-white p-8 rounded-lg shadow-md\">\n<div class=\"flex items-center mb-4\">\n<div class=\"bg-green-100 rounded-full p-3 mr-4\">\n<i class=\"fas fa-download text-green-600 text-xl\"></i>\n</div>\n<h3 class=\"text-xl font-bold text-gray-800\">Standard Installation</h3>\n</div>\n<p class=\"text-gray-600 mb-4\">Install the latest stable release from PyPI:</p>\n<div class=\"bg-gray-900 text-green-400 p-4 rounded-lg mb-4 font-mono text-sm\">\n<div># Install the semantic self-aware kit</div>\n<div>pip install semantic-self-aware-kit</div>\n<div class=\"mt-2\"># Verify installation</div>\n<div>python -c \"import semantic_self_aware_kit; print('Installed successfully!')\"</div>\n</div>\n</div>\n</div>\n<!-- Dependencies -->\n<div class=\"mt-8 bg-white p-6 rounded-lg shadow-sm\">\n<h3 class=\"text-lg font-bold mb-4 text-gray-800\">\ud83d\udccb Core Dependencies</h3>\n<p class=\"text-gray-600 mb-4\">The framework will automatically install all required packages from `requirements.txt`.</p>\n</div>\n</div>",
      "classes": "py-16 bg-gray-50"
    },
    {
      "type": "section",
      "title": "",
      "content": "<div class=\"max-w-6xl mx-auto px-4\">\n<h2 class=\"text-3xl font-bold mb-8 text-gray-800\">How to Use the Components</h2>\n<p class=\"text-lg text-gray-600 mb-8 text-center\">\n                The Semantic Self-Aware Kit provides a suite of powerful components for building intelligent AI systems. Here\u2019s how you can start using them.\n            </p>\n<div class=\"space-y-8\">\n<!-- Metacognitive Cascade -->\n<div class=\"bg-gray-50 p-6 rounded-lg\">\n<h3 class=\"text-xl font-bold mb-4 text-gray-800\">Structured Decision-Making with `metacognitive_cascade`</h3>\n<p class=\"text-gray-700 mb-4\">For any complex decision, use the `metacognitive_cascade` to ensure a structured and uncertainty-aware process. This is ideal for situations where the AI needs to be transparent about its reasoning.</p>\n<div class=\"bg-gray-900 text-green-400 p-4 rounded-lg font-mono text-sm\">\n<div>from semantic_self_aware_kit.metacognitive_cascade import cascade</div>\n<div class=\"mt-2\">decision = \"Should I refactor this complex module?\"</div>\n<div>result = cascade.run_full_cascade(decision)</div>\n<div class=\"mt-2\">print(f\"Confidence: {result.confidence_level}, Actions: {result.required_actions}\")</div>\n</div>\n</div>\n<!-- Code Intelligence Analyzer -->\n<div class=\"bg-gray-50 p-6 rounded-lg\">\n<h3 class=\"text-xl font-bold mb-4 text-gray-800\">Understanding Code with `code_intelligence_analyzer`</h3>\n<p class=\"text-gray-700 mb-4\">To gain a deep understanding of a codebase, use the `code_intelligence_analyzer`. It combines code archaeology, semantic analysis, and architectural insights.</p>\n<div class=\"bg-gray-900 text-green-400 p-4 rounded-lg font-mono text-sm\">\n<div>from semantic_self_aware_kit.code_intelligence_analyzer import CodeIntelligenceAnalyzer</div>\n<div class=\"mt-2\">analyzer = CodeIntelligenceAnalyzer(\"./my_project\")</div>\n<div>analysis = analyzer.comprehensive_analysis()</div>\n<div class=\"mt-2\">print(analysis['synthesis']['key_recommendations'])</div>\n</div>\n</div>\n<!-- Empirical Performance Analyzer -->\n<div class=\"bg-gray-50 p-6 rounded-lg\">\n<h3 class=\"text-xl font-bold mb-4 text-gray-800\">Measuring Performance with `empirical_performance_analyzer`</h3>\n<p class=\"text-gray-700 mb-4\">To objectively measure the performance of your AI, use the `empirical_performance_analyzer`. It provides metrics on speed, reliability, and quality.</p>\n<div class=\"bg-gray-900 text-green-400 p-4 rounded-lg font-mono text-sm\">\n<div>from semantic_self_aware_kit.empirical_performance_analyzer import EmpiricalPerformanceAnalyzer</div>\n<div class=\"mt-2\">analyzer = EmpiricalPerformanceAnalyzer()</div>\n<div>benchmark_results = analyzer.comprehensive_benchmark(\"my_ai_agent\")</div>\n<div class=\"mt-2\">print(benchmark_results['executive_summary'])</div>\n</div>\n</div>\n</div>\n</div>",
      "classes": "py-16 bg-white"
    },
    {
      "type": "section",
      "title": "",
      "content": "<div class=\"max-w-4xl mx-auto px-4 text-center\">\n<h2 class=\"text-3xl font-bold mb-8 text-gray-800\">\ud83c\udf89 Next Steps</h2>\n<p class=\"text-lg text-gray-600 mb-8\">\n                You are now ready to start building with the Semantic Self-Aware Kit. Here\u2019s what to explore next:\n            </p>\n<div class=\"grid md:grid-cols-2 gap-6\">\n<a class=\"bg-white p-6 rounded-lg shadow-md hover:shadow-lg transition-shadow\" href=\"components.html\">\n<i class=\"fas fa-puzzle-piece text-3xl text-indigo-600 mb-4\"></i>\n<h3 class=\"text-xl font-bold text-gray-800 mb-2\">Explore Components</h3>\n<p class=\"text-gray-600\">Dive deeper into the capabilities of each component.</p>\n</a>\n<a class=\"bg-white p-6 rounded-lg shadow-md hover:shadow-lg transition-shadow\" href=\"examples.html\">\n<i class=\"fas fa-code text-3xl text-green-600 mb-4\"></i>\n<h3 class=\"text-xl font-bold text-gray-800 mb-2\">View Examples</h3>\n<p class=\"text-gray-600\">See more practical examples and tutorials.</p>\n</a>\n</div>\n</div>",
      "classes": "py-16 bg-gray-50"
    }
  ]
}